{
  "schema_version": 1,
  "generated_at": "2026-08-23T08:00:00Z",
  "workspace": {"id": "research-notes", "name": "Research Notes"},
  "projects": [
    {"id": "example", "title": "Example", "path": "wiki/projects/example", "page_count": 1}
  ],
  "sources": [
    {
      "id": "S-001",
      "title": "Example source",
      "kind": "manual_file",
      "path": "wiki/sources/S-001.md",
      "content_path": "raw/inbox/example.md",
      "captured_at": "2026-08-23T08:00:00Z",
      "status": "captured",
      "content_hash": "sha256:example"
    }
  ],
  "pages": [
    {
      "path": "wiki/projects/example/overview.md",
      "title": "Example",
      "kind": "project_overview",
      "source_refs": ["S-001"],
      "content": "# Example\n"
    }
  ],
  "operations": [
    {
      "operation_id": "op_example",
      "type": "synthesis",
      "status": "proposed",
      "requested_at": "2026-08-23T08:00:00Z",
      "actor": "owner_via_agent",
      "changes_count": 1
    }
  ]
}
